{
  "benefitsCatalogueVersion": "0.2.0",
  "_provenance": "Issuer-document sourcing pass completed 2026-08-16. Nine cards were re-derived from issuer-published Certificates of Insurance / Guides to Coverage and are marked issuerPage; unverified stub values were not carried forward. Crypto.com Royal Indigo remains stub because the exact prepaid-card agreement was found but no Certificate of Insurance or explicit certificate-level no-insurance statement was located. issuerPage is not a substitute for Zubair's own cardholder-document verification.",
  "triggers": {
    "bigTicketThresholdCad": 150,
    "consumableCategories": [
      "dining",
      "grocery",
      "foodDelivery",
      "gasStation",
      "transit",
      "drugStore",
      "entertainment",
      "fitness"
    ]
  },
  "cards": [
    {
      "cardId": "amex-platinum",
      "certificate": {
        "underwriter": "Belair Insurance Company Inc.",
        "sourceUrl": "https://www.americanexpress.com/content/dam/amex/en-ca/insurance/pdfs/certificates-of-insurance/The-Platinum-Card-COI-EN.pdf",
        "certificateDate": "2025-07",
        "lastVerifiedAt": "2026-08-16",
        "verificationStatus": "issuerPage"
      },
      "benefits": [
        {
          "benefitId": "platinum-purchase-protection",
          "family": "shopping",
          "kind": "purchaseProtection",
          "coverage": {
            "windowDays": 120,
            "maxPerOccurrenceCad": 1000
          },
          "conditions": [
            "At least part of the purchase price must be charged to the Card."
          ],
          "exclusions": [],
          "certificateQuote": null,
          "notes": "Certificate provides 120 days of Purchase Protection; the old 90-day stub was not retained."
        },
        {
          "benefitId": "platinum-extended-warranty",
          "family": "shopping",
          "kind": "extendedWarranty",
          "coverage": {
            "extraYears": 1,
            "maxOriginalWarrantyYears": 5
          },
          "conditions": [
            "Eligible original manufacturer warranty must be five years or less."
          ],
          "exclusions": [],
          "certificateQuote": null,
          "notes": "Buyer’s Assurance extends an eligible original warranty by up to one additional year."
        },
        {
          "benefitId": "platinum-flight-delay",
          "family": "travelDisruption",
          "kind": "flightDelay",
          "coverage": {
            "delayHours": 4,
            "maxCad": 1000
          },
          "conditions": [
            "The eligible ticket fare must be charged to the Card."
          ],
          "exclusions": [],
          "certificateQuote": null,
          "notes": "Maximum is per occurrence for reasonable necessary expenses covered by the delay benefit."
        },
        {
          "benefitId": "platinum-baggage-delay",
          "family": "travelDisruption",
          "kind": "baggageDelay",
          "coverage": {
            "delayHours": 6,
            "maxCad": 1000
          },
          "conditions": [
            "The eligible ticket fare must be charged to the Card."
          ],
          "exclusions": [],
          "certificateQuote": null,
          "notes": "Coverage is for emergency purchases when checked baggage is delayed."
        },
        {
          "benefitId": "platinum-baggage-loss",
          "family": "travelDisruption",
          "kind": "baggageLoss",
          "coverage": {
            "maxCad": 1000
          },
          "conditions": [
            "The eligible ticket fare must be charged to the Card."
          ],
          "exclusions": [],
          "certificateQuote": null,
          "notes": "Certificate includes lower sublimits for some property classes, including jewellery and golf equipment."
        },
        {
          "benefitId": "platinum-trip-cancellation",
          "family": "travelDisruption",
          "kind": "tripCancellation",
          "coverage": {
            "maxCad": 2500
          },
          "conditions": [
            "Loss must result from a covered cause under the Trip Cancellation certificate."
          ],
          "exclusions": [],
          "certificateQuote": null,
          "notes": "$2,500 maximum per insured person; $5,000 combined maximum per trip."
        },
        {
          "benefitId": "platinum-trip-interruption",
          "family": "travelDisruption",
          "kind": "tripInterruption",
          "coverage": {
            "maxCad": 2500
          },
          "conditions": [
            "Loss must result from a covered cause after departure under the Trip Interruption certificate."
          ],
          "exclusions": [],
          "certificateQuote": null,
          "notes": "$2,500 maximum per insured person; $6,000 combined maximum per trip."
        },
        {
          "benefitId": "platinum-rental-cdw",
          "family": "rentalCdw",
          "kind": "rentalCdw",
          "coverage": {
            "maxRentalDays": 48,
            "maxVehicleValueCad": 85000
          },
          "conditions": [
            "Charge the full rental cost to the Card.",
            "Decline the rental agency collision/loss damage waiver."
          ],
          "exclusions": [
            "Vehicles above the certificate's $85,000 MSRP threshold are not eligible."
          ],
          "certificateQuote": null,
          "notes": "Maximum rental period is 48 consecutive days."
        },
        {
          "benefitId": "platinum-travel-medical",
          "family": "travelMedical",
          "kind": "travelMedical",
          "coverage": {
            "maxCad": 5000000,
            "maxTripLengthDays": 15,
            "ageLimit": 65
          },
          "conditions": [
            "Insured person must be a Canadian resident covered by a government health insurance plan."
          ],
          "exclusions": [
            "Coverage is limited to insured persons age 64 or under on departure."
          ],
          "certificateQuote": null,
          "notes": "Up to $5,000,000 per insured person per trip; first 15 consecutive days are covered."
        }
      ]
    },
    {
      "cardId": "amex-cobalt",
      "certificate": {
        "underwriter": "Belair Insurance Company Inc.",
        "sourceUrl": "https://americanexpress.com/content/dam/amex/en-ca/insurance/pdfs/certificates-of-insurance/Cobalt-Card-COI-EN.pdf",
        "certificateDate": "2025-07",
        "lastVerifiedAt": "2026-08-16",
        "verificationStatus": "issuerPage"
      },
      "benefits": [
        {
          "benefitId": "cobalt-purchase-protection",
          "family": "shopping",
          "kind": "purchaseProtection",
          "coverage": {
            "windowDays": 90,
            "maxPerOccurrenceCad": 1000
          },
          "conditions": [
            "At least part of the purchase price must be charged to the Card."
          ],
          "exclusions": [],
          "certificateQuote": null,
          "notes": null
        },
        {
          "benefitId": "cobalt-extended-warranty",
          "family": "shopping",
          "kind": "extendedWarranty",
          "coverage": {
            "extraYears": 1,
            "maxOriginalWarrantyYears": 5
          },
          "conditions": [
            "Eligible original manufacturer warranty must be five years or less."
          ],
          "exclusions": [],
          "certificateQuote": null,
          "notes": null
        },
        {
          "benefitId": "cobalt-mobile-device",
          "family": "shopping",
          "kind": "mobileDeviceInsurance",
          "coverage": {
            "maxCad": 1000,
            "deductibleCad": null
          },
          "conditions": [
            "The device/payment arrangement must meet the certificate's Card-charging requirements."
          ],
          "exclusions": [],
          "certificateQuote": null,
          "notes": "Maximum $1,000. Deductible is 10% of the depreciated value, so no fixed deductibleCad is encoded; depreciation is 2% per completed month."
        },
        {
          "benefitId": "cobalt-flight-delay",
          "family": "travelDisruption",
          "kind": "flightDelay",
          "coverage": {
            "delayHours": 4,
            "maxCad": 500
          },
          "conditions": [
            "The eligible ticket fare must be charged to the Card."
          ],
          "exclusions": [],
          "certificateQuote": null,
          "notes": null
        },
        {
          "benefitId": "cobalt-baggage-delay",
          "family": "travelDisruption",
          "kind": "baggageDelay",
          "coverage": {
            "delayHours": 6,
            "maxCad": 500
          },
          "conditions": [
            "The eligible ticket fare must be charged to the Card."
          ],
          "exclusions": [],
          "certificateQuote": null,
          "notes": null
        },
        {
          "benefitId": "cobalt-baggage-loss",
          "family": "travelDisruption",
          "kind": "baggageLoss",
          "coverage": {
            "maxCad": 500
          },
          "conditions": [
            "The eligible ticket fare must be charged to the Card."
          ],
          "exclusions": [],
          "certificateQuote": null,
          "notes": null
        },
        {
          "benefitId": "cobalt-rental-cdw",
          "family": "rentalCdw",
          "kind": "rentalCdw",
          "coverage": {
            "maxRentalDays": 48,
            "maxVehicleValueCad": 85000
          },
          "conditions": [
            "Charge the full rental cost to the Card.",
            "Decline the rental agency collision/loss damage waiver."
          ],
          "exclusions": [
            "Vehicles above the certificate's $85,000 MSRP threshold are not eligible."
          ],
          "certificateQuote": null,
          "notes": null
        },
        {